lightllm/common/triton_utils/autotune_kernel_configs/triton_3.4.0/NVIDIA_H200/grouped_matmul:v1/{K=256,N=7168,expert_num=257,mul_routed_weight=true,out_dtype=torch.bfloat16,topk_num=1,use_fp8_w8a8=true}_NVIDIA_H200.json
{
  "1152": {
    "BLOCK_SIZE_K": 128,
    "BLOCK_SIZE_M": 16,
    "BLOCK_SIZE_N": 128,
    "GROUP_SIZE_M": 32,
    "NEED_TRANS": true,
    "num_stages": 2,
    "num_warps": 4
  },
  "144": {
    "BLOCK_SIZE_K": 128,
    "BLOCK_SIZE_M": 16,
    "BLOCK_SIZE_N": 128,
    "GROUP_SIZE_M": 64,
    "NEED_TRANS": true,
    "num_stages": 2,
    "num_warps": 4
  },
  "147456": {
    "BLOCK_SIZE_K": 128,
    "BLOCK_SIZE_M": 64,
    "BLOCK_SIZE_N": 128,
    "GROUP_SIZE_M": 16,
    "NEED_TRANS": false,
    "num_stages": 3,
    "num_warps": 4
  },
  "18432": {
    "BLOCK_SIZE_K": 128,
    "BLOCK_SIZE_M": 64,
    "BLOCK_SIZE_N": 128,
    "GROUP_SIZE_M": 32,
    "NEED_TRANS": false,
    "num_stages": 3,
    "num_warps": 4
  },
  "2304": {
    "BLOCK_SIZE_K": 128,
    "BLOCK_SIZE_M": 16,
    "BLOCK_SIZE_N": 128,
    "GROUP_SIZE_M": 64,
    "NEED_TRANS": true,
    "num_stages": 2,
    "num_warps": 4
  },
  "288": {
    "BLOCK_SIZE_K": 128,
    "BLOCK_SIZE_M": 16,
    "BLOCK_SIZE_N": 128,
    "GROUP_SIZE_M": 64,
    "NEED_TRANS": true,
    "num_stages": 2,
    "num_warps": 4
  },
  "36": {
    "BLOCK_SIZE_K": 128,
    "BLOCK_SIZE_M": 16,
    "BLOCK_SIZE_N": 128,
    "GROUP_SIZE_M": 64,
    "NEED_TRANS": true,
    "num_stages": 2,
    "num_warps": 4
  },
  "36864": {
    "BLOCK_SIZE_K": 128,
    "BLOCK_SIZE_M": 64,
    "BLOCK_SIZE_N": 128,
    "GROUP_SIZE_M": 32,
    "NEED_TRANS": false,
    "num_stages": 3,
    "num_warps": 4
  },
  "576": {
    "BLOCK_SIZE_K": 128,
    "BLOCK_SIZE_M": 16,
    "BLOCK_SIZE_N": 128,
    "GROUP_SIZE_M": 64,
    "NEED_TRANS": true,
    "num_stages": 2,
    "num_warps": 4
  },
  "72": {
    "BLOCK_SIZE_K": 128,
    "BLOCK_SIZE_M": 16,
    "BLOCK_SIZE_N": 128,
    "GROUP_SIZE_M": 64,
    "NEED_TRANS": true,
    "num_stages": 2,
    "num_warps": 4
  },
  "9": {
    "BLOCK_SIZE_K": 64,
    "BLOCK_SIZE_M": 16,
    "BLOCK_SIZE_N": 128,
    "GROUP_SIZE_M": 64,
    "NEED_TRANS": true,
    "num_stages": 3,
    "num_warps": 4
  },
  "900": {
    "BLOCK_SIZE_K": 128,
    "BLOCK_SIZE_M": 16,
    "BLOCK_SIZE_N": 128,
    "GROUP_SIZE_M": 64,
    "NEED_TRANS": true,
    "num_stages": 2,
    "num_warps": 4
  },
  "9216": {
    "BLOCK_SIZE_K": 128,
    "BLOCK_SIZE_M": 64,
    "BLOCK_SIZE_N": 128,
    "GROUP_SIZE_M": 64,
    "NEED_TRANS": false,
    "num_stages": 3,
    "num_warps": 4
  }
}