lightllm/common/all_kernel_configs/grouped_moe_gemm_kernel/{K=192,N=4096,expert_num=128,mul_routed_weight=true,out_dtype=torch.bfloat16,topk_num=1,use_fp8_w8a8=true}_NVIDIA_H100_80GB_HBM3.json
{"1": {"BLOCK_SIZE_M": 16, "BLOCK_SIZE_N": 64, "BLOCK_SIZE_K": 64, "GROUP_SIZE_M": 1, "num_warps": 2, "num_stages": 1}, "8": {"BLOCK_SIZE_M": 16, "BLOCK_SIZE_N": 64, "BLOCK_SIZE_K": 64, "GROUP_SIZE_M": 1, "num_warps": 4, "num_stages": 1}, "64": {"BLOCK_SIZE_M": 16, "BLOCK_SIZE_N": 64, "BLOCK_SIZE_K": 64, "GROUP_SIZE_M": 1, "num_warps": 4, "num_stages": 4}, "128": {"BLOCK_SIZE_M": 16, "BLOCK_SIZE_N": 128, "BLOCK_SIZE_K": 64, "GROUP_SIZE_M": 4, "num_warps": 8, "num_stages": 4}, "256": {"BLOCK_SIZE_M": 32, "BLOCK_SIZE_N": 64, "BLOCK_SIZE_K": 64, "GROUP_SIZE_M": 1, "num_warps": 4, "num_stages": 4}, "512": {"BLOCK_SIZE_M": 32, "BLOCK_SIZE_N": 128, "BLOCK_SIZE_K": 64, "GROUP_SIZE_M": 4, "num_warps": 4, "num_stages": 4}, "1024": {"BLOCK_SIZE_M": 32, "BLOCK_SIZE_N": 128, "BLOCK_SIZE_K": 64, "GROUP_SIZE_M": 4, "num_warps": 4, "num_stages": 3}, "4096": {"BLOCK_SIZE_M": 64, "BLOCK_SIZE_N": 128, "BLOCK_SIZE_K": 64, "GROUP_SIZE_M": 4, "num_warps": 8, "num_stages": 4}, "8192": {"BLOCK_SIZE_M": 64, "BLOCK_SIZE_N": 128, "BLOCK_SIZE_K": 64, "GROUP_SIZE_M": 4, "num_warps": 8, "num_stages": 4}}