lightllm/common/all_kernel_configs/moe_silu_and_mul_kernel/{N=128,out_dtype=torch.bfloat16}_NVIDIA_H200.json
{"1": {"BLOCK_M": 1, "BLOCK_N": 128, "num_warps": 1, "NUM_STAGES": 1}, "8": {"BLOCK_M": 1, "BLOCK_N": 128, "num_warps": 1, "NUM_STAGES": 1}, "64": {"BLOCK_M": 1, "BLOCK_N": 64, "num_warps": 2, "NUM_STAGES": 2}, "128": {"BLOCK_M": 1, "BLOCK_N": 128, "num_warps": 1, "NUM_STAGES": 1}, "200": {"BLOCK_M": 1, "BLOCK_N": 128, "num_warps": 1, "NUM_STAGES": 1}, "256": {"BLOCK_M": 1, "BLOCK_N": 128, "num_warps": 1, "NUM_STAGES": 1}, "512": {"BLOCK_M": 1, "BLOCK_N": 128, "num_warps": 1, "NUM_STAGES": 1}, "1024": {"BLOCK_M": 1, "BLOCK_N": 128, "num_warps": 1, "NUM_STAGES": 1}, "2048": {"BLOCK_M": 4, "BLOCK_N": 128, "num_warps": 1, "NUM_STAGES": 4}, "4096": {"BLOCK_M": 4, "BLOCK_N": 128, "num_warps": 2, "NUM_STAGES": 8}, "8192": {"BLOCK_M": 4, "BLOCK_N": 128, "num_warps": 1, "NUM_STAGES": 8}}