lightllm/common/triton_utils/autotune_kernel_configs/triton_3.3.1/NVIDIA_H200/silu_and_mul_fwd:v1/{N=2304,out_dtype=torch.bfloat16}_NVIDIA_H200.json
{
  "1": {
    "BLOCK_M": 64,
    "BLOCK_N": 256,
    "NUM_STAGES": 1,
    "num_warps": 8
  },
  "1024": {
    "BLOCK_M": 32,
    "BLOCK_N": 64,
    "NUM_STAGES": 4,
    "num_warps": 1
  },
  "128": {
    "BLOCK_M": 32,
    "BLOCK_N": 256,
    "NUM_STAGES": 4,
    "num_warps": 4
  },
  "16": {
    "BLOCK_M": 128,
    "BLOCK_N": 256,
    "NUM_STAGES": 4,
    "num_warps": 4
  },
  "16384": {
    "BLOCK_M": 64,
    "BLOCK_N": 256,
    "NUM_STAGES": 4,
    "num_warps": 1
  },
  "2048": {
    "BLOCK_M": 32,
    "BLOCK_N": 128,
    "NUM_STAGES": 4,
    "num_warps": 1
  },
  "256": {
    "BLOCK_M": 32,
    "BLOCK_N": 256,
    "NUM_STAGES": 4,
    "num_warps": 4
  },
  "4096": {
    "BLOCK_M": 32,
    "BLOCK_N": 128,
    "NUM_STAGES": 4,
    "num_warps": 1
  },
  "64": {
    "BLOCK_M": 32,
    "BLOCK_N": 256,
    "NUM_STAGES": 4,
    "num_warps": 4
  },
  "8": {
    "BLOCK_M": 128,
    "BLOCK_N": 256,
    "NUM_STAGES": 4,
    "num_warps": 4
  }
}